{
  "authority_mode": "serial",
  "candidate_schema": "release-candidate-admission-v2",
  "mechanism_schema": "release-mechanism-qualification-v2",
  "policy_sha256": "b1aedc4bc995ad491b51fb059d2900a7b5e778414381851fbf1d042501c499aa",
  "release_schema": "release-certificate-v2",
  "schema_version": 2
}
